jobtitle,company,city,state,industry,skilltag,Hadoop,Spark,R,SAS,Stata,Java,Perl,Python,SQL,NoSQL,Tableau,Excel,Machine Learning,Amazon Web Service
Data Scientist,National Security Agency,Fort Meade,MD,"Cybersecurity, Federal Agencies, Signals Analysis","machine-learning, r, unity3d",FALSE,FALSE,TRUE,FALSE,FALSE,FALSE,FALSE,FALSE,FALSE,FALSE,FALSE,FALSE,TRUE,FALSE
Senior DevOps Engineer K8s | Data Science Platform,Contiamo,Berlin,Germany,"B2B, Data & Analytics, Data Science","docker, kubernetes, rancher, go, ansible",FALSE,FALSE,TRUE,FALSE,FALSE,FALSE,FALSE,TRUE,FALSE,FALSE,FALSE,FALSE,FALSE,FALSE
IT Specialist - Forensic Examiner (Collegiate Hiring),Federal Bureau of Investigation (FBI),Washington,DC,"Cybersecurity, Federal Agencies, Law Enforcement","computer-science, bigdata, data-science, cloud, database",FALSE,FALSE,FALSE,FALSE,FALSE,FALSE,FALSE,FALSE,FALSE,FALSE,FALSE,FALSE,FALSE,FALSE
Senior Data Scientist,FindHotel,Amsterdam,Netherlands,"Data Analysis, Digital Marketing, Online Travel","scala, python, data-science, amazon-web-services, apache-spark",FALSE,TRUE,FALSE,FALSE,FALSE,FALSE,FALSE,TRUE,FALSE,FALSE,FALSE,FALSE,TRUE,FALSE
SQL Data Analyst,Detroit Trading Company,Birmingham,MI,51-200 people,"sql, excel, pivot-table, r",FALSE,FALSE,TRUE,FALSE,FALSE,FALSE,FALSE,FALSE,TRUE,FALSE,FALSE,TRUE,FALSE,FALSE
Data Scientist (e-Commerce/ Machine Learning/ Python/ Zalon),Zalando SE,Berlin,Germany,eCommerce,"data-science, algorithms, python, machine-learn, scala",FALSE,FALSE,FALSE,FALSE,FALSE,FALSE,FALSE,TRUE,FALSE,FALSE,FALSE,FALSE,TRUE,FALSE
Senior Data Scientist - Machine Learning Expert (m/f),MYTOYS GROUP,Berlin,Germany,E-Commerce,"r, machine-learning, python",FALSE,FALSE,TRUE,FALSE,FALSE,FALSE,FALSE,TRUE,TRUE,FALSE,FALSE,FALSE,TRUE,FALSE
Sr Software Engineer (Data Science),T. Rowe Price,Baltimore,MD,Financial Services,"java, python, r, data-science, amazon-web-services",FALSE,FALSE,TRUE,FALSE,FALSE,TRUE,FALSE,TRUE,FALSE,FALSE,FALSE,FALSE,FALSE,TRUE
Lead Data Scientist,Careem,Berlin,Germany,"Software Development / Engineering, Transportation","machine-learning, statistics, fraud-prevention, algorithm",FALSE,FALSE,TRUE,FALSE,FALSE,FALSE,FALSE,FALSE,FALSE,FALSE,FALSE,FALSE,TRUE,FALSE
"Data Science Engineer, Systems",MZ,Palo Alto,CA,"Digital Marketing, Gaming, Internet of Things","r, scala, java, apache-spark",TRUE,TRUE,TRUE,FALSE,FALSE,TRUE,FALSE,TRUE,FALSE,FALSE,FALSE,FALSE,TRUE,FALSE
Washington D.C Data Science Bootcamp Mentor,Thinkful Inc.,Washington,DC,"Online Education, Web Development","design, javascript, reactjs, node.js",FALSE,FALSE,FALSE,FALSE,FALSE,FALSE,FALSE,TRUE,FALSE,FALSE,FALSE,FALSE,TRUE,FALSE
"Data Analyst - SQL, R",K-LOVE& Air1 Christian Radio,Rocklin,CA,"Broadcast, Media, Non-Profit","tableau, sql, r, javascript, tsql",FALSE,FALSE,TRUE,FALSE,FALSE,FALSE,FALSE,TRUE,TRUE,FALSE,TRUE,FALSE,FALSE,FALSE
Data Science Engineer,Gogo,Chicago,IL,"Aerospace, Aviation, Telecommunications","apache-spark, java, scala, python, amazon-kinesis",FALSE,TRUE,TRUE,FALSE,FALSE,TRUE,FALSE,TRUE,FALSE,FALSE,FALSE,FALSE,FALSE,FALSE
Data Scientist / Machine Learning Expert - Agoda,Big Wednesday Digital,Bangkok,Thailand,NA,"scala, nlp, java, r, metlab",FALSE,FALSE,TRUE,FALSE,FALSE,TRUE,FALSE,TRUE,TRUE,FALSE,FALSE,FALSE,TRUE,FALSE
Senior Data Scientist => Paid Relocation to Amsterdam <=,Booking.com,Amsterdam,Netherlands,"E-Commerce, Internet Marketing, Travel & Tourism","r, machine-learning, python, sql",TRUE,FALSE,TRUE,FALSE,FALSE,FALSE,FALSE,TRUE,TRUE,FALSE,FALSE,FALSE,TRUE,FALSE
Data Scientist,Grindr,West Hollywood,CA,"Big Data, Social Media, Software Development","r, sql, data, python, postgresql",FALSE,TRUE,TRUE,FALSE,FALSE,FALSE,FALSE,TRUE,TRUE,FALSE,FALSE,FALSE,TRUE,FALSE
"Senior Data Science Engineer, Infrastructure",AdRoll,San Francisco,CA,"Ad Tech, Digital Marketing","c++, java, machine-learning",FALSE,FALSE,FALSE,FALSE,FALSE,TRUE,FALSE,FALSE,FALSE,FALSE,FALSE,FALSE,TRUE,FALSE
Data Scientist (m/f) | Hamburg,Kreditech,Hamburg,Germany,Financial Technology,"java, sql, nosql",FALSE,FALSE,TRUE,FALSE,FALSE,TRUE,FALSE,TRUE,TRUE,TRUE,FALSE,FALSE,TRUE,FALSE
Data Scientist with strong interest in financial markets,A Priori Investment Management,New York,NY,"Data Science, Finance, Market Research","java, c++, python, machine-learning",FALSE,FALSE,FALSE,FALSE,FALSE,TRUE,FALSE,TRUE,FALSE,FALSE,FALSE,FALSE,TRUE,FALSE
Head of Data Science,OfferUp,Bellevue,WA,"Mobile Application, Software Development, Software Development / Engineering","machine-learning, r, python, java",FALSE,FALSE,TRUE,FALSE,FALSE,TRUE,FALSE,TRUE,FALSE,FALSE,FALSE,FALSE,TRUE,FALSE
Data Analyst,Jane.com,Lehi,UT,Retail Industry,"r, sql, statistics, experimental-design, machine-learning",FALSE,FALSE,TRUE,FALSE,FALSE,FALSE,FALSE,TRUE,TRUE,FALSE,FALSE,TRUE,TRUE,FALSE
Data Analyst - Finance,VerticalScope Inc.,ON,Canada,Digital Media,"remote, toronto",FALSE,FALSE,FALSE,FALSE,FALSE,FALSE,FALSE,TRUE,TRUE,FALSE,FALSE,FALSE,FALSE,FALSE
Data Analyst in Product Management,Secret Sauce Partners,Budapest,Hungary,11-50 people,"r, python, sql, amazon-redshift",FALSE,TRUE,TRUE,FALSE,FALSE,TRUE,FALSE,TRUE,TRUE,FALSE,FALSE,FALSE,FALSE,FALSE
Senior Data Scientist working with cutting edge research into online behaviour,Qubit,London,UK,"Computer Software, Data & Analytics, Software Development","machine-learning, python, statistics, r",FALSE,FALSE,TRUE,FALSE,FALSE,FALSE,FALSE,TRUE,FALSE,FALSE,FALSE,FALSE,TRUE,FALSE
"Director, Data Science & Insights",Achievement Network,Boston,MA,"Education, Non-Profit","sql, business-intelligence, r, google-analytics, tableau",FALSE,FALSE,TRUE,TRUE,TRUE,FALSE,FALSE,FALSE,TRUE,FALSE,TRUE,TRUE,FALSE,FALSE
Business (Data) Analyst,Shane Co.,Centennial,CO,"Consumer Products, Jewelry, Luxury Goods","data-modeling, hadoop, sql, sap, matlab",TRUE,FALSE,TRUE,TRUE,FALSE,FALSE,FALSE,FALSE,TRUE,FALSE,TRUE,TRUE,FALSE,FALSE
Senior Data Scientist,LoopMe,London,UK,"Ad Tech, Advertising Technology, Artificial Intelligence","r, machine-learning, python",FALSE,FALSE,TRUE,FALSE,FALSE,FALSE,FALSE,TRUE,FALSE,FALSE,FALSE,FALSE,TRUE,FALSE
Senior Data Science Engineer,Rakuten,Setagaya,Japan,"E-Commerce, Mobile Application, Mobile Payments","etl, python, hadoop, mapreduce, hive",TRUE,FALSE,FALSE,FALSE,FALSE,FALSE,FALSE,TRUE,TRUE,TRUE,FALSE,FALSE,TRUE,FALSE
Data Scientist - Payments,Zalando Payments SE & Co.KG,Berlin,Germany,eCommerce,"machinelearning, apache-spark, scala, java, python",FALSE,TRUE,TRUE,FALSE,FALSE,TRUE,FALSE,TRUE,FALSE,FALSE,FALSE,TRUE,TRUE,FALSE
Senior Data Scientist / Machine Learning Engineer,TopDevz,Sacramento,CA,Agile Software Development,"r, machine-learning, go, python, elk-stack",FALSE,FALSE,TRUE,FALSE,FALSE,FALSE,FALSE,TRUE,TRUE,FALSE,FALSE,FALSE,TRUE,FALSE
Data Scientist - Brain AI,"Brain Technologies, Inc.",San Mateo,CA,"Artificial Intelligence, Machine Learning, Natural User Interaction","machine-learning, python, nlp",FALSE,FALSE,FALSE,FALSE,FALSE,FALSE,FALSE,TRUE,FALSE,FALSE,FALSE,FALSE,TRUE,FALSE
Sr. Data Scientist,Ebates,San Francisco,CA,"eCommerce, Marketing, Retail Apps","r, machine-learning, sql",FALSE,FALSE,TRUE,FALSE,FALSE,FALSE,FALSE,FALSE,TRUE,FALSE,FALSE,FALSE,TRUE,FALSE
"Data Scientist/Quantitative Analyst, Engineering",Google,Mountain View,CA,10k+ people,"r, sql, statistics, python, pandas",FALSE,FALSE,TRUE,FALSE,FALSE,FALSE,FALSE,TRUE,TRUE,FALSE,FALSE,FALSE,TRUE,FALSE
"Data Scientist / Big Data Engineer (Java, Scala, Javascript, Python, Hadoop, R, SQL,...",BlackRock,New York,NY,NA,"java, scala, javascript, python, hadoop",TRUE,TRUE,TRUE,FALSE,FALSE,TRUE,FALSE,TRUE,TRUE,FALSE,FALSE,FALSE,TRUE,FALSE
Fast-Growing Startup looking for a Data Scientist / Data Engineer,Creatubbles,No office location,No office location,"Information Technology, Social Networking","mixpanel, google-analytics, statistics, database",FALSE,FALSE,FALSE,FALSE,FALSE,FALSE,FALSE,FALSE,FALSE,FALSE,FALSE,FALSE,FALSE,FALSE
Data Scientist,Buzzfeed,Los Angeles,CA,"Digital Media, Entertainment, News","sql, python, machine-learning, pandas, scipy",FALSE,FALSE,FALSE,FALSE,FALSE,FALSE,FALSE,TRUE,TRUE,FALSE,FALSE,FALSE,TRUE,FALSE
"Data Scientist / Machine Learning Engineer, Consumer Hardware Startup",Sense,Cambridge,MA,"Consumer Electronics, Energy & Environment, Internet of Things","python, time-series, machine-learning, c, c++",FALSE,FALSE,FALSE,FALSE,FALSE,FALSE,FALSE,TRUE,FALSE,FALSE,FALSE,FALSE,TRUE,FALSE
Machine Learning Engineer (m/f),HelloFresh,Berlin,Germany,1k-5k people,"airflow, python, machine-learning, docker, apache-spark",TRUE,TRUE,FALSE,FALSE,FALSE,FALSE,FALSE,TRUE,TRUE,TRUE,FALSE,FALSE,TRUE,FALSE
Senior Data Scientist,Bechtel Corporate,Houston,TX,"Construction, Civil Engineering, Project Management","deep-learning, machine-learning, python, sql, algorithm",TRUE,FALSE,TRUE,FALSE,FALSE,TRUE,FALSE,TRUE,TRUE,FALSE,FALSE,FALSE,TRUE,TRUE
Software Engineer,Volant Trading,New York,NY,Capital Markets,"c, c++, python, shell, linux",FALSE,FALSE,FALSE,FALSE,FALSE,FALSE,FALSE,TRUE,FALSE,FALSE,FALSE,FALSE,FALSE,FALSE
Software Engineer,TrackMaven,Washington,DC,"Content Marketing, Data & Analytics, Integrated Marketing Solutions","python, django, angularjs, docker, javascript",FALSE,FALSE,FALSE,FALSE,FALSE,FALSE,FALSE,TRUE,FALSE,FALSE,FALSE,FALSE,FALSE,FALSE
Android Developer,FarmLogs,Ann Arbor,MI,51-200 people,"android, java, mobile",FALSE,FALSE,FALSE,FALSE,FALSE,TRUE,FALSE,FALSE,FALSE,FALSE,FALSE,FALSE,FALSE,FALSE
"Software Engineer (Big Data, Python, Full Stack)",University of Chicago | Center for Data Intensive Science,Chicago,IL,"Big Data, Biotechnology, Cloud Computing","python, postgresql, microservices, kubernetes, ubuntu",FALSE,FALSE,FALSE,FALSE,FALSE,TRUE,FALSE,TRUE,FALSE,FALSE,FALSE,FALSE,FALSE,FALSE
Technical Product Owner - SUPERCRUNCH by GfK,Supercrunch by GfK,NÌ_rnberg,Deutschland,Market Research,,FALSE,FALSE,FALSE,FALSE,FALSE,FALSE,FALSE,FALSE,FALSE,FALSE,FALSE,FALSE,FALSE,FALSE
Data Scientists wanted!,Oliver Wyman Labs,Boston,MA,"Agile Software Development, Consulting, Machine Learning","machine-learning, r, sql, python, apache-spark",FALSE,TRUE,TRUE,FALSE,FALSE,FALSE,FALSE,TRUE,TRUE,TRUE,FALSE,FALSE,TRUE,FALSE
Software Engineer,P2Binvestor,Denver,CO,NA,"ruby-on-rails, javascript, postgresql, amazon-web-services",FALSE,FALSE,FALSE,FALSE,FALSE,FALSE,FALSE,FALSE,FALSE,FALSE,FALSE,FALSE,FALSE,FALSE
Data Management Practice Lead,Omni Resources,Milwaukee,WI,Information Technology,"hadoop, analytics",TRUE,FALSE,FALSE,FALSE,FALSE,TRUE,FALSE,TRUE,TRUE,FALSE,FALSE,FALSE,FALSE,FALSE
Dev Ops Engineer,Alphonso Inc,Mountain View,CA,"Advertising Technology, Big Data, Embedded","linux, chef, puppet, docker",FALSE,FALSE,FALSE,FALSE,FALSE,FALSE,FALSE,FALSE,TRUE,TRUE,FALSE,FALSE,FALSE,FALSE
Principal Software Engineer,TVision Insights,Boston,MA,11-50 people,"c++, python, amazon-web-services, windows, scala",FALSE,FALSE,FALSE,FALSE,FALSE,FALSE,FALSE,TRUE,FALSE,FALSE,FALSE,FALSE,FALSE,FALSE
Senior Software Engineer,Domino Data Lab,San Francisco,CA,51-200 people,"scala, kubernetes, docker, reactjs, amazon-web-services",FALSE,FALSE,FALSE,FALSE,FALSE,FALSE,FALSE,FALSE,FALSE,FALSE,FALSE,FALSE,FALSE,FALSE
"Director of Engineering, Human Digital Interfaces",Mobiquity Inc.,Wayne,PA,"B2B, Digital Asset Management, Mobile","ios, android, iot, mobile, java",FALSE,FALSE,FALSE,FALSE,FALSE,TRUE,FALSE,FALSE,FALSE,FALSE,FALSE,FALSE,FALSE,TRUE
Data Engineer,Qntfy,Arlington,VA,"Behavioral Analytics, Data & Analytics, Software Development / Engineering","go, docker, apache-kafka, mesos, grpc",FALSE,TRUE,FALSE,FALSE,FALSE,TRUE,FALSE,FALSE,FALSE,FALSE,FALSE,FALSE,TRUE,FALSE
Senior Software Engineer,Cadre (NYC),New York,NY,"Commercial Real Estate, Financial Technology, Private Investments","javascript, node.js, postgresql, amazon-web-services, python",FALSE,FALSE,FALSE,FALSE,FALSE,FALSE,FALSE,TRUE,FALSE,FALSE,FALSE,FALSE,FALSE,FALSE
Sales Engineer,Shield.Ai,San Francisco,CA,NA,sales,FALSE,FALSE,FALSE,FALSE,FALSE,FALSE,FALSE,FALSE,FALSE,FALSE,FALSE,FALSE,FALSE,FALSE
Data Architect,Datalicious Pty Ltd,Bengaluru,India,11-50 people,"amazon-web-services, cloud, architecture, python",FALSE,TRUE,FALSE,FALSE,FALSE,FALSE,FALSE,TRUE,FALSE,TRUE,FALSE,FALSE,FALSE,TRUE
Data Analytics Instructor - Rutgers University (Part-Time),Trilogy Education Services,Franklin Township,NJ,201-500 people,"pandas, d3.js, python, javascript, sql",TRUE,FALSE,FALSE,FALSE,FALSE,FALSE,FALSE,TRUE,TRUE,TRUE,TRUE,FALSE,TRUE,FALSE
Data Engineer,Bauer Xcel Media,New York,NY,51-200 people,"machine-learning, apache-spark, hadoop, amazon-redshift, bigdata",TRUE,TRUE,FALSE,FALSE,FALSE,FALSE,FALSE,FALSE,FALSE,TRUE,FALSE,FALSE,TRUE,FALSE
Product Support (m/f),EXASOL,London,UK,Data Analysis,"sql, business-intelligence",FALSE,FALSE,FALSE,FALSE,FALSE,FALSE,FALSE,FALSE,TRUE,FALSE,FALSE,FALSE,FALSE,FALSE
Data Engineer,IMC Financial Markets,Chicago,IL,201-500 people,"hadoop, python, bigdata, java, sql",TRUE,TRUE,FALSE,FALSE,FALSE,TRUE,FALSE,TRUE,TRUE,FALSE,FALSE,FALSE,TRUE,FALSE
Research Associate,Massachusetts Institute of Technology (MIT),Cambridge,MA,NA,state-of-the-art-visualiz,FALSE,FALSE,FALSE,FALSE,FALSE,TRUE,FALSE,TRUE,TRUE,FALSE,FALSE,FALSE,TRUE,FALSE
Senior Data Engineer,Comcast,Philadelphia,PA,Public,"machine-learning, apache-spark, linux",TRUE,TRUE,FALSE,FALSE,FALSE,TRUE,FALSE,FALSE,FALSE,FALSE,FALSE,FALSE,FALSE,FALSE
AI Researcher/Engineer,Square Enix,Shinjuku,Japan,NA,"c++, artificial-intelligence, machine-learning, statistics",FALSE,FALSE,FALSE,FALSE,FALSE,FALSE,FALSE,FALSE,FALSE,FALSE,FALSE,FALSE,TRUE,FALSE
Software Engineer @ IDEO / Creatively Build Beautiful Products,IDEO San Francisco,San Francisco,CA,"Consulting, Creative Services, Design","ruby-on-rails, design, javascript, angular, mysql",FALSE,FALSE,FALSE,FALSE,FALSE,FALSE,FALSE,FALSE,FALSE,FALSE,FALSE,FALSE,FALSE,FALSE
HPC Software Engineer,EM Photonics,Newark,DE,11-50 people,"c++, python, qt, cuda, mpi",FALSE,FALSE,FALSE,FALSE,FALSE,FALSE,FALSE,TRUE,FALSE,FALSE,FALSE,FALSE,FALSE,FALSE
WEYV Software Engineer,WEYV,Troy,MI,"Computer Software, Software Development / Engineering, Technology Consulting","java, oop, amazon-s3, rdbms, sql",FALSE,FALSE,FALSE,FALSE,FALSE,TRUE,FALSE,FALSE,TRUE,FALSE,FALSE,FALSE,FALSE,FALSE
"AWS, Dev Ops Engineer, Analytics",Financial Engines,Sunnyvale,CA,"Financial Services, Financial Technology","amazon-web-services, python, ansible, jenkins, linux",FALSE,FALSE,FALSE,FALSE,FALSE,TRUE,FALSE,TRUE,FALSE,FALSE,TRUE,FALSE,FALSE,TRUE
Senior Data Engineer,eBay,San Jose,CA,Public,java,TRUE,FALSE,FALSE,FALSE,FALSE,TRUE,FALSE,TRUE,FALSE,FALSE,FALSE,FALSE,TRUE,FALSE
Full Stack Scala Engineer,Fractal Industries,Reston,VA,"Artificial Intelligence, Cybersecurity, Data & Analytics","javascript, scala, npm",FALSE,FALSE,FALSE,FALSE,FALSE,FALSE,FALSE,FALSE,FALSE,FALSE,FALSE,FALSE,FALSE,FALSE
Senior iOS Engineer,"BlueOwl, LLC.",San Francisco,CA,Insurance,"ios, objective-c, swift",FALSE,FALSE,FALSE,FALSE,FALSE,FALSE,FALSE,FALSE,FALSE,FALSE,FALSE,FALSE,FALSE,FALSE
Sr Software Engineer,Apple Inc.,Cupertino,CA,10k+ people,"ios, mac, osx, lua, c++",TRUE,FALSE,FALSE,FALSE,FALSE,TRUE,FALSE,FALSE,FALSE,TRUE,FALSE,FALSE,TRUE,FALSE
Senior Python Engineer,VoiceBase Inc.,San Francisco,CA,11-50 people,"python, r, numpy, matplotlib, django",FALSE,FALSE,TRUE,FALSE,FALSE,FALSE,FALSE,TRUE,FALSE,FALSE,FALSE,FALSE,TRUE,FALSE
Senior Big Data Architect,GameDuell,Berlin,Deutschland,51-200 people,"etl, hadoop, apache-kafka, apache-storm, apache-spark",TRUE,TRUE,FALSE,FALSE,FALSE,FALSE,FALSE,FALSE,FALSE,FALSE,FALSE,FALSE,FALSE,FALSE
Senior Software Engineer - Ruby,Spreemo Health,New York,NY,Healthcare,"ruby-on-rails, ruby, amazon-web-services, docker",FALSE,FALSE,FALSE,FALSE,FALSE,FALSE,FALSE,FALSE,FALSE,FALSE,FALSE,FALSE,FALSE,FALSE
Senior Web Developer,C8Sciences,New Haven,CT,"Computer Games, Digital Health, Education Technology","c#, asp.net-mvc, sql-server, jquery, amazon",FALSE,FALSE,TRUE,FALSE,FALSE,FALSE,FALSE,FALSE,TRUE,TRUE,FALSE,FALSE,FALSE,FALSE
Software Engineer - Scala (m/f) | Hamburg,Kreditech Holding SSL GmbH,Hamburg,Germany,Financial Technology,"scala, sql, rdbms, http, rest",FALSE,FALSE,FALSE,FALSE,FALSE,TRUE,FALSE,FALSE,TRUE,FALSE,FALSE,FALSE,FALSE,FALSE
Big Data - DBA (Database Administrator),Spherexx,Tulsa,OK,"Business Intelligence, CRM, Real Estate","database-administration, c#, sql, javascript, microsoft, sysadmin",TRUE,TRUE,TRUE,FALSE,FALSE,TRUE,FALSE,TRUE,TRUE,FALSE,FALSE,FALSE,FALSE,FALSE
Software Engineer- Forward Deployed | AI Startup,HyperScience,New York,NY,11-50 people,"java, c++, python, distributed-computing",FALSE,FALSE,FALSE,FALSE,FALSE,TRUE,FALSE,TRUE,FALSE,FALSE,FALSE,FALSE,FALSE,FALSE
Senior Software Engineer - We use Ruby to Sell Rubies!,Catawiki,Amsterdam,Netherlands,eCommerce,"ruby-on-rails, ruby",FALSE,FALSE,FALSE,FALSE,FALSE,FALSE,FALSE,FALSE,FALSE,FALSE,FALSE,FALSE,FALSE,FALSE
Senior Java Developer - Spring,84.51å¡,Cincinnati,OH,"Consulting, Data Science, Retail Analytics","java, spring, spring-mvc, spring-boot, scrum",FALSE,FALSE,FALSE,FALSE,FALSE,TRUE,FALSE,FALSE,TRUE,FALSE,FALSE,FALSE,FALSE,FALSE
Senior / Lead Data Engineer - Einstein,Salesforce,San Francisco,CA,"Cloud Services, Information Technology, Software Development","scala, apache-spark, apache-kafka, hadoop, cassandra",TRUE,TRUE,FALSE,FALSE,FALSE,FALSE,FALSE,FALSE,FALSE,FALSE,FALSE,TRUE,TRUE,FALSE
Software Developer ‰ÛÒ Imaging,DuPont Pioneer,Johnston,IA,10k+ people,"python, linux, aws, computer-vision, image-processing",FALSE,FALSE,FALSE,FALSE,FALSE,FALSE,FALSE,TRUE,TRUE,TRUE,FALSE,FALSE,TRUE,FALSE
"Engineering Manager,  Python",iHeartRadio,New York,NY,Software Development / Engineering,"python, mongodb, cassandra, sql, nosql",FALSE,FALSE,FALSE,FALSE,FALSE,FALSE,FALSE,TRUE,TRUE,TRUE,FALSE,FALSE,FALSE,FALSE
Lead Data Engineer,Wallaby Financial,Pasadena,CA,"Financial Technology, Mobile Application","java, redis, hibernate, postgresql, amazon-web-services",TRUE,FALSE,FALSE,FALSE,FALSE,TRUE,FALSE,FALSE,FALSE,TRUE,FALSE,FALSE,FALSE,FALSE
Senior Data Engineer,EdgeRock Technology Partners,New York,NY,201-500 people,"r, amazon-web-services, hadoop, machine-learning, sql",TRUE,FALSE,TRUE,FALSE,FALSE,TRUE,FALSE,FALSE,TRUE,TRUE,FALSE,FALSE,TRUE,TRUE
Web Developer,European Molecular Biology Laboratory (EMBL),Heidelberg,Germany,1k-5k people,"d3.js, python, web-services",FALSE,TRUE,FALSE,FALSE,FALSE,FALSE,FALSE,TRUE,FALSE,FALSE,FALSE,FALSE,FALSE,TRUE
Scala Developer (m/f),Risk.Ident GmbH,Hamburg,Deutschland,"Big Data, Fraud, Machine Learning","jvm, scala, sbt, agile, sql",FALSE,FALSE,FALSE,FALSE,FALSE,FALSE,FALSE,FALSE,TRUE,TRUE,FALSE,FALSE,FALSE,FALSE
ETL (Informatica) Developer,O'Reilly Auto Parts,Springfield,MO,10k+ people,"etl, design, informatica, microstrategy, informatica-powercenter",FALSE,FALSE,FALSE,FALSE,FALSE,FALSE,FALSE,FALSE,TRUE,FALSE,FALSE,FALSE,FALSE,FALSE
Senior Software Engineer,Granular,Champaign,IL,51-200 people,"python, javascript, postgresql, django, c++",FALSE,FALSE,FALSE,FALSE,FALSE,FALSE,FALSE,TRUE,FALSE,FALSE,FALSE,FALSE,FALSE,FALSE
Sr. Software Engineer |Big Data,Time Inc.,Tampa,FL,5k-10k people,"amazon-web-services, cloud, hadoop",TRUE,TRUE,TRUE,FALSE,FALSE,TRUE,FALSE,TRUE,FALSE,FALSE,FALSE,FALSE,TRUE,FALSE
Senior Big Data Developer - Hadoop,American Family,Madison,WI,Private,"hadoop, apache-spark, r",TRUE,TRUE,TRUE,TRUE,FALSE,TRUE,FALSE,TRUE,FALSE,FALSE,FALSE,FALSE,FALSE,FALSE
"Backend Product Engineer, Python",TellusLabs,Somerville,MA,"Data & Analytics, Financial Technology, Geographic Information System","python, flask, restful-architecture, postgresql",FALSE,FALSE,FALSE,FALSE,FALSE,FALSE,FALSE,TRUE,TRUE,FALSE,FALSE,FALSE,TRUE,FALSE
Software Developer (m/w) mit Herzblut fÌ_r Big Data,WidasConcepts,Wimsheim,Deutschland,51-200 people,"hadoop, nosql, apache-spark, apache-storm, elastic",TRUE,TRUE,FALSE,FALSE,FALSE,FALSE,FALSE,FALSE,FALSE,TRUE,FALSE,FALSE,FALSE,FALSE
Software Architect | Big Data,Time Inc,Seattle,WA,5k-10k people,"aws, oozie, sqoop, kafka, hadoop",TRUE,TRUE,TRUE,FALSE,FALSE,TRUE,FALSE,TRUE,FALSE,FALSE,FALSE,FALSE,TRUE,FALSE
Senior Software Engineer (Python),Entrepreneurial Finance Lab,Cambridge,MA,"Data Science, Fintech","python, django, mysql, node.js, mongodb",FALSE,FALSE,TRUE,FALSE,FALSE,TRUE,FALSE,TRUE,TRUE,FALSE,FALSE,FALSE,FALSE,FALSE
"Data Engineer, Data Warehouse",Komodo Health,San Francisco,CA,11-50 people,"java, hadoop, python, postgresql, scala",TRUE,TRUE,FALSE,FALSE,FALSE,TRUE,FALSE,TRUE,TRUE,FALSE,FALSE,FALSE,FALSE,FALSE
Senior Java Developer (Remote),IdeaScale,Berkeley,CA,Innovation Software,"java, spring, tdd, machine-learning, angularjs",FALSE,FALSE,FALSE,FALSE,FALSE,TRUE,FALSE,FALSE,TRUE,TRUE,FALSE,FALSE,FALSE,FALSE
DevOps Manager - Global Enterprise Tax Solutions,PwC,Albany,NY,10k+ people,"devops, automation, linuxexperience",FALSE,FALSE,FALSE,FALSE,FALSE,TRUE,FALSE,FALSE,TRUE,FALSE,FALSE,FALSE,FALSE,FALSE
"Software Engineer, Data Platform",Cortico,Cambridge,MA,"Artificial Intelligence, Data Science, Media","python, aws, elasticsearch, hadoop, machine-learning",TRUE,TRUE,FALSE,FALSE,FALSE,FALSE,FALSE,TRUE,FALSE,FALSE,FALSE,FALSE,TRUE,FALSE
Operations Developer,Hudson River Trading,New York,NY,51-200 people,"python, linux",FALSE,FALSE,FALSE,FALSE,FALSE,FALSE,FALSE,TRUE,TRUE,FALSE,FALSE,FALSE,FALSE,FALSE
Senior Software Engineer,"Veritone, Inc.",Costa Mesa,CA,"Artificial Intelligence, Data Science, SaaS","node.js, angularjs, reactjs, go, postgresql",FALSE,FALSE,FALSE,FALSE,FALSE,FALSE,FALSE,FALSE,FALSE,FALSE,FALSE,FALSE,FALSE,FALSE
Array of Things Systems Administrator,The University of Chicago,Chicago,IL,"Academic Research, Data Science","python, linux, amazon-web-services, sysadmin",FALSE,FALSE,FALSE,FALSE,FALSE,FALSE,FALSE,TRUE,FALSE,FALSE,FALSE,FALSE,FALSE,FALSE
C# language analysis research engineer,Semmle,Oxford,UK,11-50 people,"c#, .net, parsing, compiler-construction, static-analysis",FALSE,FALSE,FALSE,FALSE,FALSE,FALSE,FALSE,FALSE,FALSE,FALSE,FALSE,FALSE,FALSE,FALSE
"Mid/Senior/Lead Scala Engineer - Scala, Spark, Hadoop",The Quantium Group,Sydney,Australia,"Big Data, Data & Analytics, Data Science","scala, hadoop, apache-spark, mapr, functional-programming",TRUE,TRUE,FALSE,FALSE,FALSE,TRUE,FALSE,FALSE,TRUE,FALSE,FALSE,FALSE,FALSE,FALSE
Frontend Web Developer,Gigantum,Washington,DC,"Academic Research, Big Data, Data Science","reactjs, javascript, relay, webpack, sass",FALSE,FALSE,FALSE,FALSE,FALSE,FALSE,FALSE,FALSE,FALSE,FALSE,FALSE,FALSE,FALSE,FALSE
Senior Ruby Engineer,Mitre Media Corp.,ON,Canada,11-50 people,"ruby, ruby-on-rails, html, css, javascript",FALSE,FALSE,FALSE,FALSE,FALSE,FALSE,FALSE,FALSE,FALSE,FALSE,FALSE,FALSE,FALSE,FALSE
Full Stack Rails Developer,"Location, Inc",Worcester,MA,"Insurance, Location Based Services, Real Estate","ruby-on-rails, postgresql, amazon-web-services, javascript, html",FALSE,FALSE,FALSE,FALSE,FALSE,FALSE,FALSE,FALSE,FALSE,FALSE,FALSE,FALSE,FALSE,FALSE
iOS Developer,StreamDetroit,Ferndale,MI,"Content Marketing, Digital Marketing, SaaS","ios, swift, mobile",FALSE,FALSE,FALSE,FALSE,FALSE,FALSE,FALSE,TRUE,FALSE,FALSE,FALSE,FALSE,TRUE,FALSE